{
  "envelope_version": 1,
  "resource": "propagation",
  "schema_id": "https://console.mainline.trappoint.org/contracts/1.0/propagation.schema.json",
  "observed_at": "2026-08-07T02:15:00.000Z",
  "server_date": "2026-08-07T02:15:00.000Z",
  "staged": true,
  "staged_note": "Hand-authored demonstration bundle. No CockroachDB cluster and no MAINLINE kernel produced these bytes: every payload below was written by the data-contracts-replay worker to exercise the console against its own contracts while the kernel and read API were being built. The SQLSTATEs, constraint names and column names are taken from ARCHITECTURE.md §5 and spec/wire/refusal.md and are therefore real claims about the design; the values are not observations. Any screen fed by this bundle says STAGED, and no number on it may be quoted as a measurement.",
  "statement_refs": [
    {
      "kind": "table",
      "object": "mainline.propagation",
      "text": null,
      "sql_path": null
    },
    {
      "kind": "table",
      "object": "mainline.merge_conflict",
      "text": null,
      "sql_path": null
    }
  ],
  "provenance": [
    {
      "pointer": "/lesson/control_delta",
      "chip": "db:constraint"
    },
    {
      "pointer": "/propagations/0/state",
      "chip": "db:column"
    },
    {
      "pointer": "/propagations/1/declination_kind",
      "chip": "db:column"
    }
  ],
  "data": {
    "lesson": {
      "lesson_id": "018f3a34-1100-7a40-8811-e73a5b2d6091",
      "origin_site": "018f3a2e-0000-7000-8000-000000000001",
      "origin_commit": "3d7f406e8091c3543d7f406e8091c3543d7f406e8091c3543d7f406e8091c354",
      "anchor_event": "018f3a31-8800-7d50-9f77-5ea1c243d608",
      "max_severity": 5,
      "control_delta": "strengthen",
      "patch_digest": "e28fbc3b3b21e10fe28fbc3b3b21e10fe28fbc3b3b21e10fe28fbc3b3b21e10f",
      "merge_base": "2c6e3f5d7f90b2432c6e3f5d7f90b2432c6e3f5d7f90b2432c6e3f5d7f90b243",
      "title": "Verify residual stored energy at every accumulator, not at the pump"
    },
    "propagations": [
      {
        "lesson_id": "018f3a34-1100-7a40-8811-e73a5b2d6091",
        "site_id": "018f3a2e-0000-7000-8000-000000000002",
        "site_code": "GRV-02",
        "state": "adopted",
        "score": 0.91,
        "model_version": "fleet-appraisal@2026-06-02",
        "proposed_at": "2021-12-02T00:00:00.000Z",
        "due_by": "2022-01-16T00:00:00.000Z",
        "adopted_commit": "4e8051719192d4654e8051719192d4654e8051719192d4654e8051719192d465",
        "already_present_clause": null,
        "open_conflicts": 0,
        "declination_kind": null,
        "declination_predicate_id": null,
        "declination_expires_at": null
      },
      {
        "lesson_id": "018f3a34-1100-7a40-8811-e73a5b2d6091",
        "site_id": "018f3a2e-0000-7000-8000-000000000003",
        "site_code": "NTH-11",
        "state": "declined",
        "score": 0.63,
        "model_version": "fleet-appraisal@2026-06-02",
        "proposed_at": "2021-12-02T00:00:00.000Z",
        "due_by": "2022-01-16T00:00:00.000Z",
        "adopted_commit": null,
        "already_present_clause": null,
        "open_conflicts": 1,
        "declination_kind": "mechanism_absent",
        "declination_predicate_id": "018f3a38-1100-7a10-8e88-5ea1c243d608",
        "declination_expires_at": null
      }
    ],
    "conflicts": [
      {
        "conflict_id": "018f3a34-2200-7b50-9922-f84b6c3e71a2",
        "lesson_id": "018f3a34-1100-7a40-8811-e73a5b2d6091",
        "site_id": "018f3a2e-0000-7000-8000-000000000003",
        "clause_uuid": "018f3a30-3300-7e20-8a42-1d0b5f88cc13",
        "base_digest": "f390cd4c4c32f210f390cd4c4c32f210f390cd4c4c32f210f390cd4c4c32f210",
        "ours_digest": "04a1de5d5d43032104a1de5d5d43032104a1de5d5d43032104a1de5d5d430321",
        "theirs_digest": "15b2ef6e6e54143215b2ef6e6e54143215b2ef6e6e54143215b2ef6e6e541432",
        "resolved_commit": null,
        "resolved_by": null,
        "resolution_source": null,
        "opened_at": "2021-12-02T00:00:00.000Z"
      }
    ]
  }
}
